[
	{
		"Peak": "Pennsylvania Mountain",
		"Elevation": "13,021",
		"Range": "Mosquito",
		"Date": "2026-09-22",
		"Image": "/images/summits/pennsylvania-mountain.avif",
		"ranked": true
	},
	{
		"Peak": "Mount Evans",
		"Elevation": "13,591",
		"Range": "Mosquito",
		"Date": "2026-09-22",
		"Image": "/images/summits/mount-evans-2.avif",
		"ranked": true
	},
	{
		"Peak": "Geneva Peak",
		"Elevation": "13,266",
		"Range": "Front",
		"Date": "2026-09-10",
		"Image": "/images/summits/geneva-peak.avif",
		"ranked": true
	},
	{
		"Peak": "Landslide Peak",
		"Elevation": "13,238",
		"Range": "Front",
		"Date": "2026-09-10",
		"Image": "/images/summits/landslide-peak.avif",
		"ranked": false
	},
	{
		"Peak": "\"Rocky Mountain\"",
		"Elevation": "13,200",
		"Range": "Front",
		"Date": "2026-09-10",
		"Image": "/images/summits/unnamed-13er.avif",
		"ranked": false
	},
	{
		"Peak": "Mount Bancroft",
		"Elevation": "13,250",
		"Range": "Front",
		"Date": "2026-08-24",
		"Image": "/images/summits/mount-bancroft.avif",
		"ranked": false
	},
	{
		"Peak": "Parry Peak",
		"Elevation": "13,367",
		"Range": "Front",
		"Date": "2026-08-24",
		"Image": "/images/summits/parry-peak.avif",
		"ranked": true
	},
	{
		"Peak": "UN 13,253",
		"Elevation": "13,253",
		"Range": "Sawatch",
		"Date": "2026-08-16",
		"Image": "/images/summits/un-13253.avif",
		"ranked": true
	},
	{
		"Peak": "Iowa Peak",
		"Elevation": "13,831",
		"Range": "Sawatch",
		"Date": "2026-08-09",
		"Image": "/images/summits/iowa-peak.avif",
		"ranked": false
	},
	{
		"Peak": "Missouri Mountain",
		"Elevation": "14,069",
		"Range": "Sawatch",
		"Date": "2026-08-09",
		"Image": "/images/summits/missouri-mountain.avif",
		"ranked": true
	},
	{
		"Peak": "Peak Nine",
		"Elevation": "13,207",
		"Range": "Tenmile",
		"Date": "2026-08-02",
		"Image": "/images/summits/peak-nine.avif",
		"ranked": true
	},
	{
		"Peak": "Peak Ten",
		"Elevation": "13,641",
		"Range": "Tenmile",
		"Date": "2026-08-02",
		"Image": "/images/summits/peak-ten.avif",
		"ranked": true
	},
	{
		"Peak": "Rogers Peak",
		"Elevation": "13,361",
		"Range": "Front",
		"Date": "2026-07-30",
		"Image": "/images/summits/rogers-peak.avif",
		"ranked": true
	},
	{
		"Peak": "Mount Warren",
		"Elevation": "13,314",
		"Range": "Front",
		"Date": "2026-07-30",
		"Image": "/images/summits/mount-warren.avif",
		"ranked": true
	},
	{
		"Peak": "Tincup Peak",
		"Elevation": "13,351",
		"Range": "Sawatch",
		"Date": "2026-07-13",
		"Image": "/images/summits/tincup-peak.jpeg",
		"ranked": true
	},
	{
		"Peak": "Duco Benchmark",
		"Elevation": "13,347",
		"Range": "San Juan",
		"Date": "2026-07-04",
		"Image": "/images/summits/duco-benchmark.jpeg",
		"ranked": true
	},
	{
		"Peak": "Mount Sneffels",
		"Elevation": "14,155",
		"Range": "San Juan",
		"Date": "2026-07-03",
		"Image": "/images/summits/mount-sneffels.jpeg",
		"ranked": true
	},
	{
		"Peak": "Telluride Peak",
		"Elevation": "13,514",
		"Range": "San Juan",
		"Date": "2026-07-02",
		"Image": "/images/summits/telluride-peak.jpeg",
		"ranked": true
	},
	{
		"Peak": "Quandary Peak",
		"Elevation": "14,271",
		"Range": "Tenmile",
		"Date": "2026-06-20",
		"Image": "/images/summits/quandary-peak.jpeg",
		"ranked": true
	},
	{
		"Peak": "Mount Tweto",
		"Elevation": "13,642",
		"Range": "Mosquito",
		"Date": "2026-06-12",
		"Image": "/images/summits/mount-tweto.jpeg",
		"ranked": true
	},
	{
		"Peak": "Father Dyer Peak",
		"Elevation": "13,642",
		"Range": "Tenmile",
		"Date": "2026-06-06",
		"Image": "/images/summits/father-dyer-peak.jpeg",
		"ranked": false
	},
	{
		"Peak": "Crystal Peak",
		"Elevation": "13,860",
		"Range": "Tenmile",
		"Date": "2026-06-06",
		"Image": "/images/summits/crystal-peak.jpeg",
		"ranked": true
	},
	{
		"Peak": "Cupid Peak",
		"Elevation": "13,126",
		"Range": "Front",
		"Date": "2025-09-29",
		"Image": "/images/summits/cupid-peak.avif",
		"ranked": true
	},
	{
		"Peak": "Mount Sniktau",
		"Elevation": "13,239",
		"Range": "Front",
		"Date": "2025-09-29",
		"Image": "/images/summits/mount-sniktau.avif",
		"ranked": true
	},
	{
		"Peak": "Mount White",
		"Elevation": "13,663",
		"Range": "Sawatch",
		"Date": "2025-09-22",
		"Image": "/images/summits/mount-white.avif",
		"ranked": true
	},
	{
		"Peak": "Mount Parnassus",
		"Elevation": "13,579",
		"Range": "Front",
		"Date": "2025-09-15",
		"Image": "/images/summits/mount-parnassus.avif",
		"ranked": true
	},
	{
		"Peak": "UN 13,738",
		"Elevation": "13,738",
		"Range": "Sawatch",
		"Date": "2025-08-17",
		"Image": "/images/summits/un-13738.jpeg",
		"ranked": true
	},
	{
		"Peak": "Mount Champion",
		"Elevation": "13,645",
		"Range": "Sawatch",
		"Date": "2025-08-17",
		"Image": "/images/summits/mount-champion.jpeg",
		"ranked": true
	},
	{
		"Peak": "Savage Peak",
		"Elevation": "13,135",
		"Range": "Sawatch",
		"Date": "2025-08-12",
		"Image": "/images/summits/savage-peak.jpeg",
		"ranked": true
	},
	{
		"Peak": "Cottonwood Peak",
		"Elevation": "13,596",
		"Range": "Sangre de Cristo",
		"Date": "2025-08-04",
		"Image": "/images/summits/cottonwood-peak.jpeg",
		"ranked": true
	},
	{
		"Peak": "UN 13,128",
		"Elevation": "13,128",
		"Range": "Sangre de Cristo",
		"Date": "2025-08-04",
		"Image": "/images/summits/un-13128.jpeg",
		"ranked": false
	},
	{
		"Peak": "Thirsty Peak",
		"Elevation": "13,195",
		"Range": "Sangre de Cristo",
		"Date": "2025-08-04",
		"Image": "/images/summits/thirsty-peak.jpeg",
		"ranked": false
	},
	{
		"Peak": "Peerless Mountain",
		"Elevation": "13,336",
		"Range": "Mosquito",
		"Date": "2025-07-28",
		"Image": "/images/summits/peerless-mountain.jpeg",
		"ranked": true
	},
	{
		"Peak": "Mount Sheridan",
		"Elevation": "13,743",
		"Range": "Mosquito",
		"Date": "2025-07-28",
		"Image": "/images/summits/mount-sheridan.jpeg",
		"ranked": true
	},
	{
		"Peak": "Horseshoe Mountain",
		"Elevation": "13,894",
		"Range": "Mosquito",
		"Date": "2025-07-28",
		"Image": "/images/summits/horseshoe-mountain.jpeg",
		"ranked": true
	},
	{
		"Peak": "Green Mountain",
		"Elevation": "13,048",
		"Range": "San Juan",
		"Date": "2025-07-19",
		"Image": "/images/summits/green-mountain.jpeg",
		"ranked": false
	},
	{
		"Peak": "Canby Mountain",
		"Elevation": "13,458",
		"Range": "San Juan",
		"Date": "2025-07-19",
		"Image": "/images/summits/canby-mountain.jpeg",
		"ranked": true
	},
	{
		"Peak": "Ptarmigan Peak",
		"Elevation": "13,749",
		"Range": "Mosquito",
		"Date": "2025-07-14",
		"Image": "/images/summits/ptarmigan-peak.jpeg",
		"ranked": false
	},
	{
		"Peak": "Weston Peak",
		"Elevation": "13,573",
		"Range": "Mosquito",
		"Date": "2025-07-14",
		"Image": "/images/summits/weston-peak.jpeg",
		"ranked": false
	},
	{
		"Peak": "Mount Guyot",
		"Elevation": "13,297",
		"Range": "Front",
		"Date": "2025-07-13",
		"Image": "/images/summits/mount-guyot.jpeg",
		"ranked": true
	},
	{
		"Peak": "Hancock Peak",
		"Elevation": "13,111",
		"Range": "Sawatch",
		"Date": "2025-07-04",
		"Image": "/images/summits/hancock-peak.jpeg",
		"ranked": true
	},
	{
		"Peak": "Grays Peak",
		"Elevation": "14,278",
		"Range": "Front",
		"Date": "2025-06-23",
		"Image": "/images/summits/grays-peak-2.avif",
		"ranked": true
	},
	{
		"Peak": "Quail Mountain",
		"Elevation": "13,465",
		"Range": "Sawatch",
		"Date": "2025-06-15",
		"Image": "/images/summits/quail-mountain.jpeg",
		"ranked": true
	},
	{
		"Peak": "Huron Peak",
		"Elevation": "14,006",
		"Range": "Sawatch",
		"Date": "2025-06-10",
		"Image": "/images/summits/huron-peak.jpeg",
		"ranked": true
	},
	{
		"Peak": "Dyer Mountain",
		"Elevation": "13,861",
		"Range": "Mosquito",
		"Date": "2024-10-14",
		"Image": "/images/summits/dyer-mountain.avif",
		"ranked": true
	},
	{
		"Peak": "Gemini Peak",
		"Elevation": "13,961",
		"Range": "Mosquito",
		"Date": "2024-10-14",
		"Image": "/images/summits/gemini-peak.avif",
		"ranked": false
	},
	{
		"Peak": "Rito Alto Peak",
		"Elevation": "13,801",
		"Range": "Sangre de Cristo",
		"Date": "2024-10-07",
		"Image": "/images/summits/rito-alto-peak.avif",
		"ranked": true
	},
	{
		"Peak": "Jones Mountain",
		"Elevation": "13,214",
		"Range": "Sawatch",
		"Date": "2024-09-30",
		"Image": "/images/summits/jones-mountain.avif",
		"ranked": true
	},
	{
		"Peak": "Taylor Mountain",
		"Elevation": "13,655",
		"Range": "Sawatch",
		"Date": "2024-09-24",
		"Image": "/images/summits/taylor-mountain.avif",
		"ranked": true
	},
	{
		"Peak": "James Peak",
		"Elevation": "13,272",
		"Range": "Front",
		"Date": "2024-09-16",
		"Image": "/images/summits/james-peak.avif",
		"ranked": true
	},
	{
		"Peak": "Boulder Mountain",
		"Elevation": "13,530",
		"Range": "Sawatch",
		"Date": "2024-09-09",
		"Image": "/images/summits/boulder-mountain.avif",
		"ranked": true
	},
	{
		"Peak": "Mount Mamma",
		"Elevation": "13,672",
		"Range": "Sawatch",
		"Date": "2024-09-09",
		"Image": "/images/summits/mount-mamma.avif",
		"ranked": true
	},
	{
		"Peak": "Kuss Peak",
		"Elevation": "13,560",
		"Range": "Mosquito",
		"Date": "2024-09-02",
		"Image": "/images/summits/kuss-peak.avif",
		"ranked": false
	},
	{
		"Peak": "Mount Evans",
		"Elevation": "13,591",
		"Range": "Mosquito",
		"Date": "2024-09-02",
		"Image": "/images/summits/mount-evans.avif",
		"ranked": true
	},
	{
		"Peak": "Treasurevault Mountain",
		"Elevation": "13,706",
		"Range": "Mosquito",
		"Date": "2024-09-02",
		"Image": "/images/summits/treasurevault-mountain.avif",
		"ranked": false
	},
	{
		"Peak": "Mosquito Peak",
		"Elevation": "13,787",
		"Range": "Mosquito",
		"Date": "2024-09-02",
		"Image": "/images/summits/mosquito-peak.avif",
		"ranked": true
	},
	{
		"Peak": "Whale Peak",
		"Elevation": "13,080",
		"Range": "Front",
		"Date": "2024-08-26",
		"Image": "/images/summits/whale-peak.avif",
		"ranked": true
	},
	{
		"Peak": "Argentine Peak",
		"Elevation": "13,743",
		"Range": "Front",
		"Date": "2024-08-15",
		"Image": "/images/summits/argentine-peak.avif",
		"ranked": true
	},
	{
		"Peak": "Mount Lincoln",
		"Elevation": "14,293",